"Page","Section","Section Description"
"Home","Navbar",""
"","Hero Header Section","Introduction to MezTal and its unique value proposition."
"","Feature Section","Highlight the service of making hiring decisions."
"","Feature Section","Overview of training processes."
"","Feature Section","Explanation of system control."
"","Benefits Section","Details on cost savings for clients due to favorable living costs in Mexico."
"","Features List Section","List the management services provided: HR, IT, Office, Payroll, Recruiting."
"","Feature Section","Summary of staffing benefits and unique approach."
"","How It Works Section","Description of how MezTal helps streamline costs, scale operations, and add team members."
"","CTA Section","Encourage visitors to reach out and see how MezTal can help."
"","CTA Section","Provide contact information for inquiries."
"","Testimonial Section","Highlight a client testimonial from Scott Goldberg, Co-Founder & President Atlas Senior Living."
"","Footer",""
"About Us","Navbar",""
"","Header Section","Introduction to MezTal and its mission."
"","About Section","Detailed background and history of MezTal."
"","Feature Section","Highlight the MezTal team’s expertise in managing HR, IT, Office, Payroll, and Recruiting."
"","Team Section","Introduction to key team members and their roles."
"","Feature Section","Explanation of MezTal's commitment to quality and client satisfaction."
"","Testimonial Section","Client success stories and testimonials."
"","CTA Section","Encourage visitors to connect with MezTal for more information or inquiries."
"","Footer",""
"Services","Navbar",""
"","Header Section","Overview of MezTal's services and value proposition."
"","Services Section","Detailed explanation of the hiring decision-making process."
"","Services Section","In-depth look at training on processes."
"","Services Section","Overview of system control services."
"","Features List Section","List of key management services: HR, IT, Office, Payroll, Recruiting."
"","Feature Section","Description of how MezTal helps clients streamline costs."
"","Feature Section","Summary of how MezTal helps clients rapidly scale operations."
"","Feature Section","Details on how MezTal adds dynamic and powerful team members."
"","CTA Section","Encourage visitors to reach out for more information or to get started with MezTal."
"","CTA Section","Provide contact information for inquiries."
"","Footer",""
"Team","Navbar",""
"","Header Section","Introduction to the MezTal team and their roles."
"","Feature Section","Explanation of the team's role in making hiring decisions."
"","Feature Section","Overview of the training processes implemented by the team."
"","Feature Section","Description of the team's control over systems and operations."
"","Team Section","Detailed profiles of key team members, their expertise, and contributions."
"","CTA Section","Invite visitors to reach out to learn more about the team and their capabilities."
"","Footer",""
"Savings","Navbar",""
"","Header Section","Introduction to the cost savings provided by MezTal."
"","Benefits Section","Details on how cost of living in Mexico allows for competitive compensation and significant savings for US clients."
"","Feature Section","Explanation of the favorable cost of living in Mexico."
"","Feature Section","Highlight of competitive compensation packages for employees."
"","Feature Section","Overview of approximately 50% cost savings for US clients."
"","How It Works Section","Detailed explanation of how MezTal achieves cost savings while maintaining high-quality service."
"","CTA Section","Encourage visitors to contact MezTal for more information on cost savings."
"","CTA Section","Provide contact information for inquiries about cost savings."
"","Footer",""
"Management","Navbar",""
"","Header Section","Introduction to the Management services provided by MezTal."
"","Feature Section","Detail the HR management services."
"","Feature Section","Outline the IT management services."
"","Feature Section","Explain office management services."
"","Features List Section","List other management services: Payroll and Recruiting."
"","CTA Section","Encourage potential clients to reach out for more information on management services."
"","CTA Section","Provide contact information for inquiries."
"","Footer",""
"Staffing","Navbar",""
"","Header Section","Introduction to MezTal's staffing solutions and their unique benefits."
"","Feature Section","Overview of MezTal's approach to staffing: ""Staffing like you've never seen."""
"","Feature Section","Details on how MezTal allows you to build your team your way."
"","Feature Section","Explanation of how MezTal handles the ""boring stuff"" for you."
"","Feature Section","Highlight the benefits of having a team in Guadalajara, Mexico."
"","Features List Section","List the types of roles MezTal can staff: accounting, recruiting, marketing, back-office support, customer support, development, engineering, and more."
"","Feature Section","Details on the control clients have over their team members hired through MezTal."
"","CTA Section","Encourage visitors to contact MezTal to learn more about staffing solutions."
"","CTA Section","Provide contact information for inquiries."
"","Footer",""
"Testimonials","Navbar",""
"","Header Section","Introduction to the Testimonials page, highlighting client satisfaction and success stories."
"","Testimonial Section","Client testimonial from Scott Goldberg, Co-Founder & President Atlas Senior Living."
"","Testimonial Section","Additional client testimonial showcasing a different success story."
"","Testimonial Section","Another client testimonial to provide a diverse range of feedback."
"","CTA Section","Encourage potential clients to reach out and experience MezTal's services."
"","CTA Section","Provide contact information for inquiries."
"","Footer",""
"Client Testimonial","Navbar",""
"","Header Section","Header introducing the client testimonial."
"","Testimonial Section","Client testimonial highlighting the success with MezTal."
"","Feature Section","Details about the specific services provided to Atlas Senior Living."
"","Feature Section","Key metrics and results achieved through the partnership."
"","CTA Section","Encourage potential clients to reach out for similar success."
"","CTA Section","Contact information for inquiries."
"","Footer",""
"Why Guadalajara?","Navbar",""
"","Header Section","Introduce the advantages of Guadalajara as a business hub."
"","Feature Section","Proximity to US: Only 2-3 hour flight from most US cities."
"","Feature Section","Cultural Alignment: More US culturally aligned than other traditional offshoring locations."
"","Feature Section","Time Zone: Same time zone as the US, facilitating easier communication."
"","Feature Section","Economic Benefits: Lower costs for establishing technical, back office, and manufacturing operations."
"","Feature Section","Educational Background: Significant educational qualifications of the employee base."
"","Feature Section","English Proficiency: High ability to speak English in a multi-national business environment."
"","How It Works Section","Explanation of why Guadalajara is considered the ""Silicon Valley"" of Latin America."
"","CTA Section","Encourage visitors to reach out to learn more about the advantages of operating in Guadalajara."
"","Footer",""
"Benefits","Navbar",""
"","Header Section","Introduction to the benefits of partnering with MezTal."
"","Benefits Section","Highlight cost savings for US clients due to favorable living costs in Mexico."
"","Feature Section","Detail the competitive compensation packages offered to employees."
"","Feature Section","Explain how MezTal manages HR, IT, Office, Payroll, and Recruiting."
"","Feature Section","Describe the flexibility and control clients have over their team members."
"","Testimonial Section","Include additional client testimonials showcasing successful partnerships."
"","CTA Section","Encourage potential clients to reach out for more information."
"","Footer",""
"Cost","Navbar",""
"","Header Section","Introduction to the cost savings and structure with MezTal."
"","Feature Section","Explanation of the typical cost savings compared to US hiring."
"","Feature Section","Overview of the roles MezTal can help hire for, including accounting, recruiting, marketing, back-office support, customer support, development, and engineering."
"","Features List Section","Details on the 'passthrough fee' covering office, computer, onboarding, and office-related expenses."
"","Feature Section","Explanation of the control clients have over their team members, including hiring, firing, bonuses, and raises."
"","CTA Section","Encourage visitors to contact MezTal for a personalized cost estimate and further details."
"","CTA Section","Provide contact information for inquiries."
"","Footer",""
"Location","Navbar",""
"","Header Section","Title and brief introduction to the location advantages."
"","Feature Section","Proximity to the US: Only a 2-3 hour flight from most US cities."
"","Feature Section","Cultural Alignment: More US culturally aligned than other traditional offshoring locations."
"","Feature Section","Time Zone: Same time zone as the US."
"","Feature Section","Description of Guadalajara: Known as the ""Silicon Valley"" of Latin America."
"","Feature Section","Business Hub: A mecca for international businesses due to lower costs and a highly educated workforce."
"","Feature Section","Language Proficiency: Employees' ability to speak English in a multi-national business environment."
"","Feature Section","Education and Talent: Significant educational background and technical skills of the employee base."
"","CTA Section","Encourage visitors to reach out for more information on the benefits of operating in Guadalajara."
"","CTA Section","Provide contact information for inquiries."
"","Footer",""
"Contact","Navbar",""
"","Header Section","Header introducing the Contact page."
"","Contact Section","General contact information and office address."
"","Contact Form Section","Form for visitors to fill out with their inquiries."
"","Locations Section","Details and map of the Guadalajara office location."
"","CTA Section","Encouragement to reach out with any questions or for a consultation."
"","Newsletter Section","Option to subscribe to MezTal's newsletter for updates and news."
"","Footer",""
"Blog","Navbar",""
"","Featured Blog List Header Section","Introduction to the blog section and an overview of what visitors can expect to find."
"","Blog List Section","List of recent blog posts with titles, short descriptions, and publication dates."
"","Blog List Section","Categories or tags for easy navigation of different topics."
"","CTA Section","Encourage visitors to subscribe to the blog for updates."
"","Newsletter Section","Sign-up form for the blog newsletter to receive the latest posts directly in their inbox."
"","Footer",""
"Blog Post","Navbar",""
"","Blog Post Header Section","Title, author, date, and summary of the blog post."
"","Blog Post Body Section","Main content of the blog post, including text, images, and embedded media."
"","Testimonial Section","Relevant client or partner testimonials that support the blog's topic."
"","CTA Section","Call to action related to the blog post content (e.g., subscribe to newsletter, contact us, download a resource)."
"","FAQ Section","Frequently asked questions related to the blog post topic."
"","Newsletter Section","Option for readers to subscribe to the MezTal newsletter for updates and more blog posts."
"","Footer",""
"Careers","Navbar",""
"","Header Section","Introduction to career opportunities at MezTal."
"","Job Listings Section","Current job openings at MezTal."
"","Testimonial Section","Employee testimonials about working at MezTal."
"","Team Section","Overview of the team and company culture."
"","CTA Section","Encourage potential candidates to apply or contact for more information."
"","Contact Form Section","Form for job applicants to submit their applications."
"","FAQ Section","Frequently asked questions about working at MezTal and the application process."
"","Footer",""
"FAQs","Navbar",""
"","Header Section","Introduction to the FAQ page, providing answers to common questions about MezTal."
"","FAQ Section","Why Guadalajara? Explanation of the benefits of Guadalajara as a location."
"","FAQ Section","What is the cost to hire roles at MezTal? Details on cost savings and pricing structure."
"","FAQ Section","What is included in the 'passthrough fee'? Breakdown of the costs covered by the passthrough fee."
"","FAQ Section","What control do I have on my team member? Explanation of the level of control clients have over their team members."
"","FAQ Section","What roles can I hire through MezTal? Information on the types of remote positions available for hire."
"","FAQ Section","How does MezTal handle training and onboarding? Details on the training and onboarding processes."
"","FAQ Section","What is the process for hiring through MezTal? Step-by-step overview of the hiring process."
"","FAQ Section","How does MezTal ensure quality and performance? Information on performance metrics and quality control measures."
"","Footer",""
"Pricing","Navbar",""
"","Header Section","Introduction to MezTal's pricing structure."
"","Pricing Section","Overview of the competitive pricing model compared to US equivalents."
"","Feature Section","Explanation of the 'passthrough fee' and what it covers (office, computer, onboarding, office-related expenses)."
"","Pricing Comparison Section","Detailed comparison of MezTal's costs versus traditional US hiring costs."
"","Feature Section","Description of the cost benefits of hiring through MezTal, including various role examples (accounting, recruiting, marketing, etc.)."
"","CTA Section","Encourage potential clients to contact MezTal for a customized quote."
"","CTA Form Section","Form for potential clients to request more detailed pricing information or a consultation."
"","Footer",""
"Legal","Navbar",""
"","Header Section","Introduction to the Legal page and its importance."
"","Legal Page Body Section","Terms of Service detailing user obligations and company policies."
"","Legal Page Body Section","Privacy Policy outlining data collection, usage, and protection practices."
"","Legal Page Body Section","Cookie Policy explaining the use of cookies on the website."
"","Legal Page Body Section","Disclaimer addressing liability limitations and accuracy of information."
"","Legal Page Body Section","Intellectual Property Rights explaining ownership of content and trademarks."
"","Legal Page Body Section","User Conduct Guidelines specifying acceptable and prohibited behaviors."
"","Legal Page Body Section","Governing Law clause indicating the jurisdiction applicable to legal matters."
"","Legal Page Body Section","Contact Information for legal inquiries and concerns."
"","Footer",""